<?xml version="1.0" encoding="UTF-8">
<!ELEMENT direccion (nombreCompleto, correo, telefono, cumple)>
<!ELEMENT nombreCompleto(nombre, apellido)>
<!ELEMENT nombre (#PCDATA)>
<!ELEMENT apellido (#PCDATA)>
<!ELEMENT correo (#PCDATA)>
<!ELEMENT telefono (#PCDATA)>
<!ELEMENT cumple(dia, mes, anio)>
<!ELEMENT dia (#PCDATA)>
<!ELEMENT mes (#PCDATA)>
<!ELEMENT anio (#PCDATA)>